"Molecule ChEMBL ID";"Molecule Name";"Molecule Max Phase";"Molecular Weight";"#RO5 Violations";"AlogP";"Compound Key";"Smiles";"Standard Type";"Standard Relation";"Standard Value";"Standard Units";"pChEMBL Value";"Data Validity Comment";"Comment";"Uo Units";"Ligand Efficiency BEI";"Ligand Efficiency LE";"Ligand Efficiency LLE";"Ligand Efficiency SEI";"Potential Duplicate";"Assay ChEMBL ID";"Assay Description";"Assay Type";"BAO Format ID";"BAO Label";"Assay Organism";"Assay Tissue ChEMBL ID";"Assay Tissue Name";"Assay Cell Type";"Assay Subcellular Fraction";"Assay Parameters";"Assay Variant Accession";"Assay Variant Mutation";"Target ChEMBL ID";"Target Name";"Target Organism";"Target Type";"Document ChEMBL ID";"Source ID";"Source Description";"Document Journal";"Document Year";"Cell ChEMBL ID";"Properties";"Action Type";"Standard Text Value";"Value"
"CHEMBL941";"IMATINIB";"4.0";"493.62";"0";"4.59";"1";"Cc1ccc(NC(=O)c2ccc(CN3CCN(C)CC3)cc2)cc1Nc1nccc(-c2cccnc2)n1";"IC50";"'='";"38.0";"nM";"7.42";"";"";"UO_0000065";"15.03";"0.27";"2.83";"8.60";"0";"CHEMBL846547";"Inhibition of v-Abl tyrosine kinase.";"B";"BAO_0000357";"single protein format";"None";"None";"None";"None";"None";"";"";"";"CHEMBL1862";"Tyrosine-protein kinase ABL";"Homo sapiens";"SINGLE PROTEIN";"CHEMBL1130562";"1";"Scientific Literature";"Bioorg Med Chem Lett";"1997";"None";"";"";"";"0.038"
"CHEMBL941";"IMATINIB";"4.0";"493.62";"0";"4.59";"1";"Cc1ccc(NC(=O)c2ccc(CN3CCN(C)CC3)cc2)cc1Nc1nccc(-c2cccnc2)n1";"IC50";"'='";"19000.0";"nM";"4.72";"";"";"UO_0000065";"";"";"";"";"0";"CHEMBL1018039";"Cytotoxicity against human Hec1A cells after 72 hrs by alamar-blue cell viability assay";"F";"BAO_0000219";"cell-based format";"Homo sapiens";"None";"None";"HEC-1-A";"None";"";"";"";"CHEMBL3879801";"NON-PROTEIN TARGET";"";"NON-MOLECULAR";"CHEMBL1153406";"1";"Scientific Literature";"J Med Chem";"2009";"CHEMBL4295424";"";"";"";"1.9"
"CHEMBL941";"IMATINIB";"4.0";"493.62";"0";"4.59";"Imatinib";"Cc1ccc(NC(=O)c2ccc(CN3CCN(C)CC3)cc2)cc1Nc1nccc(-c2cccnc2)n1";"IC50";"'='";"0.06";"nM";"10.22";"";"";"UO_0000065";"20.71";"0.38";"5.63";"11.85";"0";"CHEMBL5216307";"Inhibition of HER2 (unknown origin) incubated for 1 hr in presence of ATP by Kinase-Glo Plus luminescence kinase assay";"B";"BAO_0000357";"single protein format";"Homo sapiens";"None";"None";"None";"None";"";"";"";"CHEMBL1824";"Receptor protein-tyrosine kinase erbB-2";"Homo sapiens";"SINGLE PROTEIN";"CHEMBL5214926";"1";"Scientific Literature";"Eur J Med Chem";"2022";"None";"TIME = 1.0 hr";"INHIBITOR";"";"0.06"
"CHEMBL941";"IMATINIB";"4.0";"493.62";"0";"4.59";"Imatinib";"Cc1ccc(NC(=O)c2ccc(CN3CCN(C)CC3)cc2)cc1Nc1nccc(-c2cccnc2)n1";"IC50";"'='";"8778.0";"nM";"5.06";"";"";"UO_0000065";"10.24";"0.19";"0.47";"5.86";"0";"CHEMBL4410728";"Inhibition of BCR/Abl Y253F mutant (unknown origin) transfected in mouse Ba/F3 cells assessed as inhibition of cell proliferation measured after 72 hrs by CellTiter-Glo luminescent cell viability assay";"B";"BAO_0000219";"cell-based format";"Homo sapiens";"None";"None";"None";"None";"";"P00519";"Y253F";"CHEMBL2096618";"Bcr/Abl fusion protein";"Homo sapiens";"CHIMERIC PROTEIN";"CHEMBL4406902";"1";"Scientific Literature";"Bioorg Med Chem Lett";"2019";"None";"";"";"";"8778.0"
"CHEMBL941";"IMATINIB";"4.0";"493.62";"0";"4.59";"Imatinib";"Cc1ccc(NC(=O)c2ccc(CN3CCN(C)CC3)cc2)cc1Nc1nccc(-c2cccnc2)n1";"IC50";"'>'";"1000.0";"nM";"";"";"";"UO_0000065";"";"";"";"";"0";"CHEMBL3607341";"Antiproliferative activity against mouse BA/F3 cells expressing Bcr-Abl T315I mutant after 72 hrs by CCK-8 assay";"F";"BAO_0000219";"cell-based format";"Mus musculus";"None";"None";"BaF3";"None";"";"";"";"CHEMBL3879801";"NON-PROTEIN TARGET";"";"NON-MOLECULAR";"CHEMBL3603836";"1";"Scientific Literature";"Bioorg Med Chem Lett";"2015";"CHEMBL3307634";"";"";"";"1.0"
"CHEMBL941";"IMATINIB";"4.0";"493.62";"0";"4.59";"COVC-3898674512";"Cc1ccc(NC(=O)c2ccc(CN3CCN(C)CC3)cc2)cc1Nc1nccc(-c2cccnc2)n1";"IC50";"";"21900.0";"nM";"";"";"No. Measurements = 1";"UO_0000065";"";"";"";"";"0";"CHEMBL4651404";"Determination of IC50 values for inhibition of SARS-CoV-2 induced cytotoxicity of VERO-E6 cells after 48 hours exposure to 0.01 MOI SARS CoV-2 virus by high content imaging";"F";"BAO_0000218";"organism-based format";"Chlorocebus sabaeus";"None";"None";"Vero C1008";"None";"";"";"";"CHEMBL4303835";"SARS-CoV-2";"Severe acute respiratory syndrome coronavirus 2";"ORGANISM";"CHEMBL4651402";"57";"IMI-CARE SARS-CoV-2 Data";"";"2021";"CHEMBL4295411";"";"";"";"0.0000219"
"CHEMBL941";"IMATINIB";"4.0";"493.62";"0";"4.59";"COVC-3898674512";"Cc1ccc(NC(=O)c2ccc(CN3CCN(C)CC3)cc2)cc1Nc1nccc(-c2cccnc2)n1";"IC50";"";"21877.62";"nM";"";"";"No. Measurements = 1";"UO_0000065";"";"";"";"";"0";"CHEMBL4651404";"Determination of IC50 values for inhibition of SARS-CoV-2 induced cytotoxicity of VERO-E6 cells after 48 hours exposure to 0.01 MOI SARS CoV-2 virus by high content imaging";"F";"BAO_0000218";"organism-based format";"Chlorocebus sabaeus";"None";"None";"Vero C1008";"None";"";"";"";"CHEMBL4303835";"SARS-CoV-2";"Severe acute respiratory syndrome coronavirus 2";"ORGANISM";"CHEMBL4651402";"57";"IMI-CARE SARS-CoV-2 Data";"";"2021";"CHEMBL4295411";"";"";"";"4.66"
"CHEMBL941";"IMATINIB";"4.0";"493.62";"0";"4.59";"1, STI571, Glivec";"Cc1ccc(NC(=O)c2ccc(CN3CCN(C)CC3)cc2)cc1Nc1nccc(-c2cccnc2)n1";"IC50";"'='";"3005.0";"nM";"5.52";"";"";"UO_0000065";"";"";"";"";"0";"CHEMBL2186854";"Antiproliferative activity against mouse BA/F3 cells expressing Bcr-Abl T315I mutant after 72 hrs by CCK-8 assay";"F";"BAO_0000219";"cell-based format";"Mus musculus";"None";"None";"BaF3";"None";"";"";"";"CHEMBL3879801";"NON-PROTEIN TARGET";"";"NON-MOLECULAR";"CHEMBL2176963";"1";"Scientific Literature";"J Med Chem";"2012";"CHEMBL3307634";"";"";"";"3005.0"
"CHEMBL941";"IMATINIB";"4.0";"493.62";"0";"4.59";"Imatinib";"Cc1ccc(NC(=O)c2ccc(CN3CCN(C)CC3)cc2)cc1Nc1nccc(-c2cccnc2)n1";"IC50";"'='";"399.0";"nM";"6.40";"";"";"UO_0000065";"12.96";"0.24";"1.81";"7.42";"0";"CHEMBL3606398";"Inhibition of wild type Bcr-Abl (unknown origin) using Tyr2 peptide substrate after 2 hrs by FRET-based Z'-lyte assay";"B";"BAO_0000224";"protein format";"Homo sapiens";"None";"None";"None";"None";"";"";"";"CHEMBL2096618";"Bcr/Abl fusion protein";"Homo sapiens";"CHIMERIC PROTEIN";"CHEMBL3603836";"1";"Scientific Literature";"Bioorg Med Chem Lett";"2015";"None";"";"";"";"0.399"
"CHEMBL941";"IMATINIB";"4.0";"493.62";"0";"4.59";"Imatinib";"Cc1ccc(NC(=O)c2ccc(CN3CCN(C)CC3)cc2)cc1Nc1nccc(-c2cccnc2)n1";"IC50";"";"";"";"";"";"Non-Toxic";"";"";"";"";"";"0";"CHEMBL4011674";"Induction of mitochondrial dysfunction in Sprague-Dawley rat liver mitochondria assessed as inhibition of mitochondrial respiration per mg mitochondrial protein measured for 20 mins by A65N-1 oxygen probe based fluorescence assay";"A";"BAO_0000252";"mitochondrion format";"Rattus norvegicus";"CHEMBL3559723";"Liver";"None";"None";"";"";"";"CHEMBL613642";"Liver";"Rattus norvegicus";"TISSUE";"CHEMBL4011582";"1";"Scientific Literature";"Hepatology";"2014";"None";"";"";"";""
"CHEMBL941";"IMATINIB";"4.0";"493.62";"0";"4.59";"Imatinib";"Cc1ccc(NC(=O)c2ccc(CN3CCN(C)CC3)cc2)cc1Nc1nccc(-c2cccnc2)n1";"IC50";"'='";"20030.0";"nM";"4.70";"";"";"UO_0000065";"9.52";"0.17";"0.11";"5.45";"0";"CHEMBL4179478";"Inhibition of ABL T315I mutant in mouse BAF3 cells assessed as reduction in cell viability after 72 hrs by MTT assay";"B";"BAO_0000219";"cell-based format";"Mus musculus";"None";"None";"None";"None";"";"P00520";"T315I";"CHEMBL3099";"Tyrosine-protein kinase ABL";"Mus musculus";"SINGLE PROTEIN";"CHEMBL4177590";"1";"Scientific Literature";"Bioorg Med Chem Lett";"2017";"None";"";"";"";"20.03"
"CHEMBL2386595";"";"None";"496.63";"0";"4.59";"3";"[2H]C([2H])([2H])N1CCN(Cc2ccc(C(=O)Nc3ccc(C)c(Nc4nccc(-c5cccnc5)n4)c3)cc2)CC1";"IC50";"'='";"682.0";"nM";"6.17";"";"";"UO_0000065";"12.49";"0.23";"1.58";"7.15";"0";"CHEMBL2388051";"Inhibition of human BCR-ABL1 expressed in mouse BA/F3 cells assessed as cell growth inhibition by ATP-depletion assay";"B";"BAO_0000219";"cell-based format";"Homo sapiens";"None";"None";"BaF3";"None";"";"";"";"CHEMBL2096618";"Bcr/Abl fusion protein";"Homo sapiens";"CHIMERIC PROTEIN";"CHEMBL2384911";"1";"Scientific Literature";"Bioorg Med Chem";"2013";"CHEMBL3307634";"";"";"";"682.0"
"CHEMBL941";"IMATINIB";"4.0";"493.62";"0";"4.59";"Imatinib";"Cc1ccc(NC(=O)c2ccc(CN3CCN(C)CC3)cc2)cc1Nc1nccc(-c2cccnc2)n1";"IC50";"'>'";"10000.0";"nM";"";"";"";"UO_0000065";"";"";"";"";"0";"CHEMBL3881245";"Cytotoxicity against human HL60 cells assessed as inhibition of cell proliferation after 48 hrs by MTT assay";"F";"BAO_0000219";"cell-based format";"Homo sapiens";"None";"None";"HL-60";"None";"";"";"";"CHEMBL3879801";"NON-PROTEIN TARGET";"";"NON-MOLECULAR";"CHEMBL3880429";"38";"SureChEMBL Patent Bioactivity Data";"";"2012";"CHEMBL3307654";"";"";"";"10.0"
"CHEMBL941";"IMATINIB";"4.0";"493.62";"0";"4.59";"Imatinib";"Cc1ccc(NC(=O)c2ccc(CN3CCN(C)CC3)cc2)cc1Nc1nccc(-c2cccnc2)n1";"IC50";"'='";"176.0";"nM";"6.75";"";"";"UO_0000065";"13.68";"0.25";"2.16";"7.83";"0";"CHEMBL4774927";"Inhibition of wild type BCR-ABL (unknown origin) incubated for 40 mins in presence of [gamma33P]ATP by scintillation method";"B";"BAO_0000224";"protein format";"Homo sapiens";"None";"None";"None";"None";"";"";"";"CHEMBL2096618";"Bcr/Abl fusion protein";"Homo sapiens";"CHIMERIC PROTEIN";"CHEMBL4765455";"1";"Scientific Literature";"Eur J Med Chem";"2020";"None";"TIME = 0.6667 hr";"INHIBITOR";"";"0.17600000000000002"
"CHEMBL941";"IMATINIB";"4.0";"493.62";"0";"4.59";"Imatinib";"Cc1ccc(NC(=O)c2ccc(CN3CCN(C)CC3)cc2)cc1Nc1nccc(-c2cccnc2)n1";"IC50";"'='";"250.0";"nM";"6.60";"";"";"UO_0000065";"13.37";"0.24";"2.01";"7.65";"1";"CHEMBL3877207";"Inhibition of kinobead binding to ABL in human K562 cells incubated for 30 mins by iTRAQ reagent-based mass spectrometric method";"B";"BAO_0000219";"cell-based format";"Homo sapiens";"None";"None";"K562";"None";"";"";"";"CHEMBL1862";"Tyrosine-protein kinase ABL";"Homo sapiens";"SINGLE PROTEIN";"CHEMBL3875233";"1";"Scientific Literature";"Nat Rev Drug Discov";"2017";"CHEMBL3308378";"";"";"";"250.0"
"CHEMBL941";"IMATINIB";"4.0";"493.62";"0";"4.59";"1";"Cc1ccc(NC(=O)c2ccc(CN3CCN(C)CC3)cc2)cc1Nc1nccc(-c2cccnc2)n1";"IC50";"'='";"223.0";"nM";"6.65";"";"";"UO_0000065";"13.48";"0.25";"2.06";"7.71";"0";"CHEMBL3878977";"Inhibition of C-terminal His-tagged human ABL1 expressed in baculovirus infected SF9 cells using Tyr 02 peptide as substrate measured after 1 hr by FRET based Z'Lyte assay";"B";"BAO_0000219";"cell-based format";"Homo sapiens";"None";"None";"Sf9";"None";"";"";"";"CHEMBL1862";"Tyrosine-protein kinase ABL";"Homo sapiens";"SINGLE PROTEIN";"CHEMBL3877303";"1";"Scientific Literature";"J Med Chem";"2017";"CHEMBL3308860";"";"";"";"223.0"
"CHEMBL941";"IMATINIB";"4.0";"493.62";"0";"4.59";"1";"Cc1ccc(NC(=O)c2ccc(CN3CCN(C)CC3)cc2)cc1Nc1nccc(-c2cccnc2)n1";"IC50";"'='";"310.0";"nM";"6.51";"";"";"UO_0000065";"";"";"";"";"0";"CHEMBL3862472";"Cytotoxicity against human K562 cells assessed as decrease in cell proliferation after 72 hrs by XTT assay";"F";"BAO_0000219";"cell-based format";"Homo sapiens";"None";"None";"K562";"None";"";"";"";"CHEMBL3879801";"NON-PROTEIN TARGET";"";"NON-MOLECULAR";"CHEMBL3861959";"1";"Scientific Literature";"Eur J Med Chem";"2016";"CHEMBL3308378";"";"";"";"310.0"
"CHEMBL941";"IMATINIB";"4.0";"493.62";"0";"4.59";"Imatinib";"Cc1ccc(NC(=O)c2ccc(CN3CCN(C)CC3)cc2)cc1Nc1nccc(-c2cccnc2)n1";"IC50";"'='";"9500.0";"nM";"5.02";"";"";"UO_0000065";"";"";"";"";"0";"CHEMBL2318561";"Cytotoxicity against mouse BA/F3 cells expressing BCR-ABL F317V mutant assessed as growth inhibition after 72 hrs by CCK-8 assay";"F";"BAO_0000219";"cell-based format";"Mus musculus";"None";"None";"BaF3";"None";"";"";"";"CHEMBL3879801";"NON-PROTEIN TARGET";"";"NON-MOLECULAR";"CHEMBL2311339";"1";"Scientific Literature";"J Med Chem";"2013";"CHEMBL3307634";"";"";"";"9.5"
"CHEMBL941";"IMATINIB";"4.0";"493.62";"0";"4.59";"Imatinib";"Cc1ccc(NC(=O)c2ccc(CN3CCN(C)CC3)cc2)cc1Nc1nccc(-c2cccnc2)n1";"IC50";"'='";"1500.0";"nM";"5.82";"";"";"UO_0000065";"11.80";"0.21";"1.23";"6.75";"0";"CHEMBL4383510";"Inhibition of active wild type His-tagged ABL (229 to 500 residues) (unknown origin) expressed in baculovirus infected sf9 cells using ABLtide as substrate after 1 hr by ADP-Glo assay";"B";"BAO_0000219";"cell-based format";"Homo sapiens";"None";"None";"Sf9";"None";"";"";"";"CHEMBL1862";"Tyrosine-protein kinase ABL";"Homo sapiens";"SINGLE PROTEIN";"CHEMBL4382204";"1";"Scientific Literature";"Eur J Med Chem";"2018";"CHEMBL3308860";"";"";"";"1.5"
"CHEMBL941";"IMATINIB";"4.0";"493.62";"0";"4.59";"Imatinib";"Cc1ccc(NC(=O)c2ccc(CN3CCN(C)CC3)cc2)cc1Nc1nccc(-c2cccnc2)n1";"IC50";"'='";"340.0";"nM";"6.47";"";"";"UO_0000065";"13.10";"0.24";"1.88";"7.50";"0";"CHEMBL3635970";"Inhibition of Bcr-Abl T315I mutant (unknown origin) by ADP-Glo assay";"B";"BAO_0000224";"protein format";"Homo sapiens";"None";"None";"None";"None";"";"P00519";"T315I";"CHEMBL2096618";"Bcr/Abl fusion protein";"Homo sapiens";"CHIMERIC PROTEIN";"CHEMBL3632610";"1";"Scientific Literature";"Eur J Med Chem";"2015";"None";"";"";"";"0.34"
"CHEMBL941";"IMATINIB";"4.0";"493.62";"0";"4.59";"Imatinib";"Cc1ccc(NC(=O)c2ccc(CN3CCN(C)CC3)cc2)cc1Nc1nccc(-c2cccnc2)n1";"IC50";"'='";"16700.0";"nM";"4.78";"";"";"UO_0000065";"";"";"";"";"0";"CHEMBL3767412";"Antiproliferative activity against human KG1a cells assessed as inhibition of cell survival after 72 hrs by MTT assay";"F";"BAO_0000219";"cell-based format";"Homo sapiens";"None";"None";"KG-1a";"None";"";"";"";"CHEMBL3879801";"NON-PROTEIN TARGET";"";"NON-MOLECULAR";"CHEMBL3763114";"1";"Scientific Literature";"Bioorg Med Chem Lett";"2016";"CHEMBL4295408";"";"";"";"16.7"
"CHEMBL941";"IMATINIB";"4.0";"493.62";"0";"4.59";"1";"Cc1ccc(NC(=O)c2ccc(CN3CCN(C)CC3)cc2)cc1Nc1nccc(-c2cccnc2)n1";"IC50";"'='";"1.1";"nM";"8.96";"";"";"UO_0000065";"18.15";"0.33";"4.37";"10.38";"0";"CHEMBL1110561";"Inhibition of wild type Bcr-Abl";"B";"BAO_0000224";"protein format";"None";"None";"None";"None";"None";"";"";"";"CHEMBL2096618";"Bcr/Abl fusion protein";"Homo sapiens";"CHIMERIC PROTEIN";"CHEMBL1155389";"1";"Scientific Literature";"J Med Chem";"2010";"None";"";"";"";"1.1"
"CHEMBL941";"IMATINIB";"4.0";"493.62";"0";"4.59";"Imatinib";"Cc1ccc(NC(=O)c2ccc(CN3CCN(C)CC3)cc2)cc1Nc1nccc(-c2cccnc2)n1";"IC50";"'>'";"100000.0";"nM";"";"";"";"UO_0000065";"";"";"";"";"1";"CHEMBL3225222";"Inhibition of c-SRC (unknown origin)";"B";"BAO_0000357";"single protein format";"Homo sapiens";"None";"None";"None";"None";"";"";"";"CHEMBL267";"Tyrosine-protein kinase SRC";"Homo sapiens";"SINGLE PROTEIN";"CHEMBL3217496";"1";"Scientific Literature";"Medchemcomm";"2012";"None";"";"";"";"100.0"
"CHEMBL941";"IMATINIB";"4.0";"493.62";"0";"4.59";"Imatinib";"Cc1ccc(NC(=O)c2ccc(CN3CCN(C)CC3)cc2)cc1Nc1nccc(-c2cccnc2)n1";"IC50";"'='";"170.0";"nM";"6.77";"";"";"UO_0000065";"13.71";"0.25";"2.18";"7.85";"1";"CHEMBL3737992";"Inhibition of human wild-type Abl after 30 mins by phosphocellulose paper disk assay using 0.1 mM EAIYAAPFAKKK peptide substrate";"B";"BAO_0000357";"single protein format";"Homo sapiens";"None";"None";"None";"None";"";"";"";"CHEMBL1862";"Tyrosine-protein kinase ABL";"Homo sapiens";"SINGLE PROTEIN";"CHEMBL3734755";"1";"Scientific Literature";"J Med Chem";"2015";"None";"";"";"";"170.0"
"CHEMBL941";"IMATINIB";"4.0";"493.62";"0";"4.59";"Imatinib";"Cc1ccc(NC(=O)c2ccc(CN3CCN(C)CC3)cc2)cc1Nc1nccc(-c2cccnc2)n1";"IC50";"'='";"74000.0";"nM";"4.13";"";"";"UO_0000065";"8.37";"0.15";"-0.46";"4.79";"0";"CHEMBL3737993";"Inhibition of Abl T315I mutant (unknown origin) after 30 mins by phosphocellulose paper disk assay using 0.1 mM EAIYAAPFAKKK peptide substrate";"B";"BAO_0000357";"single protein format";"Homo sapiens";"None";"None";"None";"None";"";"P00519";"T315I";"CHEMBL1862";"Tyrosine-protein kinase ABL";"Homo sapiens";"SINGLE PROTEIN";"CHEMBL3734755";"1";"Scientific Literature";"J Med Chem";"2015";"None";"";"";"";"74000.0"
"CHEMBL941";"IMATINIB";"4.0";"493.62";"0";"4.59";"Imatinib";"Cc1ccc(NC(=O)c2ccc(CN3CCN(C)CC3)cc2)cc1Nc1nccc(-c2cccnc2)n1";"IC50";"'='";"250.0";"nM";"6.60";"";"";"UO_0000065";"13.37";"0.24";"2.01";"7.65";"0";"CHEMBL2330095";"Inhibition of Abl1 kinase (unknown origin)";"B";"BAO_0000357";"single protein format";"Homo sapiens";"None";"None";"None";"None";"";"";"";"CHEMBL1862";"Tyrosine-protein kinase ABL";"Homo sapiens";"SINGLE PROTEIN";"CHEMBL2321864";"1";"Scientific Literature";"J Med Chem";"2013";"None";"";"";"";"250.0"
"CHEMBL941";"IMATINIB";"4.0";"493.62";"0";"4.59";"Imatinib";"Cc1ccc(NC(=O)c2ccc(CN3CCN(C)CC3)cc2)cc1Nc1nccc(-c2cccnc2)n1";"IC50";"'='";"319.0";"nM";"6.50";"";"";"UO_0000065";"13.16";"0.24";"1.91";"7.53";"0";"CHEMBL2330097";"Inhibition of Abl1 kinase (unknown origin) using Tyr 6 peptide as substrate assessed as residual enzyme activity after every 10 secs measured for 10 mins by platform assay";"B";"BAO_0000357";"single protein format";"Homo sapiens";"None";"None";"None";"None";"";"";"";"CHEMBL1862";"Tyrosine-protein kinase ABL";"Homo sapiens";"SINGLE PROTEIN";"CHEMBL2321864";"1";"Scientific Literature";"J Med Chem";"2013";"None";"";"";"";"319.0"
"CHEMBL941";"IMATINIB";"4.0";"493.62";"0";"4.59";"Imatinib";"Cc1ccc(NC(=O)c2ccc(CN3CCN(C)CC3)cc2)cc1Nc1nccc(-c2cccnc2)n1";"IC50";"'='";"337.0";"nM";"6.47";"";"";"UO_0000065";"";"";"";"";"0";"CHEMBL1763241";"Antiproliferative activity against human KU812 cells";"F";"BAO_0000219";"cell-based format";"Homo sapiens";"None";"None";"KU812 cell line";"None";"";"";"";"CHEMBL3879801";"NON-PROTEIN TARGET";"";"NON-MOLECULAR";"CHEMBL1759982";"1";"Scientific Literature";"Bioorg Med Chem Lett";"2011";"CHEMBL3308504";"";"";"";"337.0"
"CHEMBL941";"IMATINIB";"4.0";"493.62";"0";"4.59";"Imatinib";"Cc1ccc(NC(=O)c2ccc(CN3CCN(C)CC3)cc2)cc1Nc1nccc(-c2cccnc2)n1";"IC50";"'='";"330.0";"nM";"6.48";"";"";"UO_0000065";"13.13";"0.24";"1.89";"7.51";"0";"CHEMBL3881244";"Inhibition of Bcr-Abl in human K562 cells assessed as decrease in cell proliferation after 48 hrs by MTT assay";"B";"BAO_0000219";"cell-based format";"Homo sapiens";"None";"None";"K562";"None";"";"";"";"CHEMBL2096618";"Bcr/Abl fusion protein";"Homo sapiens";"CHIMERIC PROTEIN";"CHEMBL3880429";"38";"SureChEMBL Patent Bioactivity Data";"";"2012";"CHEMBL3308378";"";"";"";"0.33"
"CHEMBL941";"IMATINIB";"4.0";"493.62";"0";"4.59";"Imatinib";"Cc1ccc(NC(=O)c2ccc(CN3CCN(C)CC3)cc2)cc1Nc1nccc(-c2cccnc2)n1";"IC50";"'='";"678.0";"nM";"6.17";"";"";"UO_0000065";"";"";"";"";"0";"CHEMBL1251499";"Antiproliferative activity against BCR-ABL1 transfected mouse BA/F3 cells";"F";"BAO_0000219";"cell-based format";"Mus musculus";"None";"None";"BaF3";"None";"";"";"";"CHEMBL3879801";"NON-PROTEIN TARGET";"";"NON-MOLECULAR";"CHEMBL1250538";"1";"Scientific Literature";"Bioorg Med Chem";"2010";"CHEMBL3307634";"";"";"";"678.0"
"CHEMBL941";"IMATINIB";"4.0";"493.62";"0";"4.59";"Imatinib";"Cc1ccc(NC(=O)c2ccc(CN3CCN(C)CC3)cc2)cc1Nc1nccc(-c2cccnc2)n1";"IC50";"'='";"358.0";"nM";"6.45";"";"";"UO_0000065";"";"";"";"";"0";"CHEMBL1251502";"Antiproliferative activity against mouse M-NFS-60 cells";"F";"BAO_0000219";"cell-based format";"Mus musculus";"None";"None";"NFS-60";"None";"";"";"";"CHEMBL3879801";"NON-PROTEIN TARGET";"";"NON-MOLECULAR";"CHEMBL1250538";"1";"Scientific Literature";"Bioorg Med Chem";"2010";"CHEMBL3307327";"";"";"";"358.0"
"CHEMBL941";"IMATINIB";"4.0";"493.62";"0";"4.59";"Imatinib";"Cc1ccc(NC(=O)c2ccc(CN3CCN(C)CC3)cc2)cc1Nc1nccc(-c2cccnc2)n1";"IC50";"'>'";"100000.0";"nM";"";"";"";"UO_0000065";"";"";"";"";"1";"CHEMBL5244903";"Inhibition of c-Src (unknown origin)";"B";"BAO_0000357";"single protein format";"Homo sapiens";"None";"None";"None";"None";"";"";"";"CHEMBL267";"Tyrosine-protein kinase SRC";"Homo sapiens";"SINGLE PROTEIN";"CHEMBL5244220";"1";"Scientific Literature";"Bioorg Med Chem Lett";"2018";"None";"";"";"";"100.0"
"CHEMBL941";"IMATINIB";"4.0";"493.62";"0";"4.59";"Imatinib";"Cc1ccc(NC(=O)c2ccc(CN3CCN(C)CC3)cc2)cc1Nc1nccc(-c2cccnc2)n1";"IC50";"'='";"50.0";"nM";"7.30";"";"";"UO_0000065";"14.79";"0.27";"2.71";"8.46";"0";"CHEMBL5244902";"Inhibition of PDGFR phosphorylation in BALB/c mouse 3T3 by Western blot analysis";"B";"BAO_0000219";"cell-based format";"Mus musculus";"None";"None";"3T3";"None";"";"";"";"CHEMBL2749";"Platelet-derived growth factor receptor beta";"Mus musculus";"SINGLE PROTEIN";"CHEMBL5244220";"1";"Scientific Literature";"Bioorg Med Chem Lett";"2018";"None";"";"INHIBITOR";"";"50.0"
"CHEMBL2386595";"";"None";"496.63";"0";"4.59";"3";"[2H]C([2H])([2H])N1CCN(Cc2ccc(C(=O)Nc3ccc(C)c(Nc4nccc(-c5cccnc5)n4)c3)cc2)CC1";"IC50";"'='";"436.0";"nM";"6.36";"";"";"UO_0000065";"12.89";"0.23";"1.77";"7.37";"0";"CHEMBL2388050";"Inhibition of human BCR-ABL1 autophosphorylation expressed in mouse BA/F3 cells by ELISA";"B";"BAO_0000219";"cell-based format";"Homo sapiens";"None";"None";"BaF3";"None";"";"";"";"CHEMBL2096618";"Bcr/Abl fusion protein";"Homo sapiens";"CHIMERIC PROTEIN";"CHEMBL2384911";"1";"Scientific Literature";"Bioorg Med Chem";"2013";"CHEMBL3307634";"";"";"";"436.0"
"CHEMBL941";"IMATINIB";"4.0";"493.62";"0";"4.59";"Imatinib";"Cc1ccc(NC(=O)c2ccc(CN3CCN(C)CC3)cc2)cc1Nc1nccc(-c2cccnc2)n1";"IC50";"'>'";"133000.0";"nM";"";"Outside typical range";"";"UO_0000065";"";"";"";"";"0";"CHEMBL4028924";"Inhibition of human MRP4 overexpressed in Sf9 cell membrane vesicles assessed as uptake of [3H]-estradiol-17beta-D-glucuronide in presence of ATP and GSH measured after 20 mins by membrane vesicle transport assay";"A";"BAO_0000219";"cell-based format";"Homo sapiens";"None";"None";"None";"None";"";"";"";"CHEMBL1743128";"Multidrug resistance-associated protein 4";"Homo sapiens";"SINGLE PROTEIN";"CHEMBL4028801";"1";"Scientific Literature";"Toxicol Sci";"2013";"None";"";"";"";"133.0"
"CHEMBL941";"IMATINIB";"4.0";"493.62";"0";"4.59";"imatinib";"Cc1ccc(NC(=O)c2ccc(CN3CCN(C)CC3)cc2)cc1Nc1nccc(-c2cccnc2)n1";"IC50";"'='";"27.0";"nM";"7.57";"";"";"UO_0000065";"";"";"";"";"0";"CHEMBL1249220";"Antiproliferative activity against mouse BA/F3 Bcr-abl negative cells expressing Tel-PDGFRbeta kinase assessed as proliferation after 48 hrs by MTT assay";"F";"BAO_0000219";"cell-based format";"Mus musculus";"None";"None";"BaF3";"None";"";"";"";"CHEMBL3879801";"NON-PROTEIN TARGET";"";"NON-MOLECULAR";"CHEMBL1240306";"1";"Scientific Literature";"Nat Chem Biol";"2006";"CHEMBL3307634";"";"";"";"0.027"
"CHEMBL941";"IMATINIB";"4.0";"493.62";"0";"4.59";"Imatinib";"Cc1ccc(NC(=O)c2ccc(CN3CCN(C)CC3)cc2)cc1Nc1nccc(-c2cccnc2)n1";"IC50";"'='";"11100.0";"nM";"4.96";"";"";"UO_0000065";"";"";"";"";"0";"CHEMBL2318557";"Cytotoxicity against mouse BA/F3 cells expressing BCR-ABL H396R mutant assessed as growth inhibition after 72 hrs by CCK-8 assay";"F";"BAO_0000219";"cell-based format";"Mus musculus";"None";"None";"BaF3";"None";"";"";"";"CHEMBL3879801";"NON-PROTEIN TARGET";"";"NON-MOLECULAR";"CHEMBL2311339";"1";"Scientific Literature";"J Med Chem";"2013";"CHEMBL3307634";"";"";"";"11.1"
"CHEMBL941";"IMATINIB";"4.0";"493.62";"0";"4.59";"Imatinib";"Cc1ccc(NC(=O)c2ccc(CN3CCN(C)CC3)cc2)cc1Nc1nccc(-c2cccnc2)n1";"IC50";"'='";"309.0";"nM";"6.51";"";"";"UO_0000065";"13.19";"0.24";"1.92";"7.55";"0";"CHEMBL1763239";"Inhibition of Bcr/Abl by FRET-based Z-lyte assay";"B";"BAO_0000224";"protein format";"None";"None";"None";"None";"None";"";"";"";"CHEMBL2096618";"Bcr/Abl fusion protein";"Homo sapiens";"CHIMERIC PROTEIN";"CHEMBL1759982";"1";"Scientific Literature";"Bioorg Med Chem Lett";"2011";"None";"";"";"";"309.0"
"CHEMBL941";"IMATINIB";"4.0";"493.62";"0";"4.59";"Imatinib";"Cc1ccc(NC(=O)c2ccc(CN3CCN(C)CC3)cc2)cc1Nc1nccc(-c2cccnc2)n1";"IC50";"'='";"89.0";"nM";"7.05";"";"";"UO_0000065";"";"";"";"";"0";"CHEMBL3737981";"Growth inhibition of mouse BA/F3 cells expressing wild-type Bcr-Abl after 48 hrs by MTT assay";"F";"BAO_0000219";"cell-based format";"Mus musculus";"None";"None";"BaF3";"None";"";"";"";"CHEMBL3879801";"NON-PROTEIN TARGET";"";"NON-MOLECULAR";"CHEMBL3734755";"1";"Scientific Literature";"J Med Chem";"2015";"CHEMBL3307634";"";"";"";"89.0"
"CHEMBL941";"IMATINIB";"4.0";"493.62";"0";"4.59";"Imatinib";"Cc1ccc(NC(=O)c2ccc(CN3CCN(C)CC3)cc2)cc1Nc1nccc(-c2cccnc2)n1";"IC50";"'='";"14500.0";"nM";"4.84";"";"";"UO_0000065";"";"";"";"";"0";"CHEMBL3737994";"Growth inhibition of mouse BA/F3 cells expressing Bcr-Abl T315I mutant after 48 hrs by MTT assay";"F";"BAO_0000219";"cell-based format";"Mus musculus";"None";"None";"BaF3";"None";"";"";"";"CHEMBL3879801";"NON-PROTEIN TARGET";"";"NON-MOLECULAR";"CHEMBL3734755";"1";"Scientific Literature";"J Med Chem";"2015";"CHEMBL3307634";"";"";"";"14500.0"
"CHEMBL941";"IMATINIB";"4.0";"493.62";"0";"4.59";"Imatinib";"Cc1ccc(NC(=O)c2ccc(CN3CCN(C)CC3)cc2)cc1Nc1nccc(-c2cccnc2)n1";"IC50";"'='";"25.0";"nM";"7.60";"";"";"UO_0000065";"15.40";"0.28";"3.01";"8.81";"0";"CHEMBL5108963";"Inhibition of BCR-ABL phosphorylation in human K562 cells";"B";"BAO_0000219";"cell-based format";"Homo sapiens";"None";"None";"K562";"None";"";"";"";"CHEMBL2096618";"Bcr/Abl fusion protein";"Homo sapiens";"CHIMERIC PROTEIN";"CHEMBL5107965";"1";"Scientific Literature";"Eur J Med Chem";"2022";"None";"";"INHIBITOR";"";"25.0"
"CHEMBL941";"IMATINIB";"4.0";"493.62";"0";"4.59";"Imatinib";"Cc1ccc(NC(=O)c2ccc(CN3CCN(C)CC3)cc2)cc1Nc1nccc(-c2cccnc2)n1";"IC50";"'='";"339.0";"nM";"6.47";"";"";"UO_0000065";"";"";"";"";"0";"CHEMBL1249668";"Antiproliferation activity against mouse BA/F3 cells expressing Bcr-abl A337N mutant assessed as cell viability after 48 hrs by MTT assay";"F";"BAO_0000219";"cell-based format";"Mus musculus";"None";"None";"BaF3";"None";"";"";"";"CHEMBL3879801";"NON-PROTEIN TARGET";"";"NON-MOLECULAR";"CHEMBL1240306";"1";"Scientific Literature";"Nat Chem Biol";"2006";"CHEMBL3307634";"";"";"";"339.0"
